{
  "$schema": "https://json-schema.org/draft/2020-12/schema",
  "$id": "https://paper-explainer.local/schema/scene-ir.schema.json",
  "title": "Paper Explainer Scene IR",
  "type": "object",
  "required": ["schemaVersion", "paperId", "scenes"],
  "properties": {
    "schemaVersion": { "const": "1.0" },
    "paperId": { "$ref": "#/$defs/id" },
    "title": { "type": "string" },
    "scenes": {
      "type": "array",
      "minItems": 1,
      "items": { "$ref": "#/$defs/scene" }
    }
  },
  "$defs": {
    "id": { "type": "string", "pattern": "^[A-Za-z0-9][A-Za-z0-9._-]*$" },
    "idList": { "type": "array", "items": { "$ref": "#/$defs/id" } },
    "step": {
      "type": "object",
      "required": ["id", "narration"],
      "properties": {
        "id": { "$ref": "#/$defs/id" },
        "title": { "type": "string" },
        "narration": { "type": "string", "minLength": 1 },
        "focusIds": { "$ref": "#/$defs/idList" },
        "evidenceIds": { "$ref": "#/$defs/idList" }
      },
      "additionalProperties": true
    },
    "scene": {
      "type": "object",
      "required": ["id", "title", "type", "steps", "payload"],
      "properties": {
        "id": { "$ref": "#/$defs/id" },
        "title": { "type": "string", "minLength": 1 },
        "eyebrow": { "type": "string" },
        "type": {
          "enum": ["concept", "architecture_execution", "equation_walkthrough", "algorithm_trace", "ablation_comparison", "figure_inspector"]
        },
        "claimIds": { "$ref": "#/$defs/idList" },
        "evidenceIds": { "$ref": "#/$defs/idList" },
        "steps": { "type": "array", "minItems": 1, "items": { "$ref": "#/$defs/step" } },
        "payload": { "type": "object" }
      },
      "additionalProperties": true
    }
  },
  "additionalProperties": false
}
